{"$schema":"https://json-schema.org/draft/2020-12/schema","type":"object","required":["schemaVersion","academicYear","source","quarters","days","teachingRanges","examRanges"],"properties":{"schemaVersion":{"const":2},"academicYear":{"type":"integer"},"source":{"type":"array"},"quarters":{"type":"object"},"teachingRanges":{"type":"object"},"examRanges":{"type":"object"},"days":{"type":"array"}}}
