{
  "schemaVersion": 2,
  "academicYear": 2026,
  "source": [
    {
      "title": "Science Tokyo 2026年度 授業日程",
      "url": "https://www.titech.ac.jp/student/students/life/schedules"
    }
  ],
  "quarters": {
    "1Q": {
      "start": "2026-04-03",
      "end": "2026-06-09"
    },
    "2Q": {
      "start": "2026-06-10",
      "end": "2026-08-06"
    },
    "3Q": {
      "start": "2026-09-28",
      "end": "2026-12-02"
    },
    "4Q": {
      "start": "2026-12-03",
      "end": "2027-02-08"
    }
  },
  "teachingRanges": {
    "1Q": [
      {
        "start": "2026-04-07",
        "end": "2026-05-27"
      },
      {
        "start": "2026-05-30",
        "end": "2026-06-01"
      },
      {
        "start": "2026-06-03",
        "end": "2026-06-03"
      }
    ],
    "2Q": [
      {
        "start": "2026-06-10",
        "end": "2026-07-28"
      },
      {
        "start": "2026-07-30",
        "end": "2026-07-30"
      }
    ],
    "3Q": [
      {
        "start": "2026-10-01",
        "end": "2026-11-24"
      }
    ],
    "4Q": [
      {
        "start": "2026-12-03",
        "end": "2026-12-26"
      },
      {
        "start": "2027-01-04",
        "end": "2027-01-30"
      }
    ]
  },
  "examRanges": {
    "1Q": [
      {
        "start": "2026-05-28",
        "end": "2026-05-29"
      },
      {
        "start": "2026-06-02",
        "end": "2026-06-02"
      },
      {
        "start": "2026-06-04",
        "end": "2026-06-09"
      }
    ],
    "2Q": [
      {
        "start": "2026-07-29",
        "end": "2026-08-06"
      }
    ],
    "3Q": [
      {
        "start": "2026-11-25",
        "end": "2026-12-02"
      }
    ],
    "4Q": [
      {
        "start": "2027-02-01",
        "end": "2027-02-08"
      }
    ]
  },
  "days": [
    {
      "date": "2026-05-23",
      "type": "no-class",
      "label": {
        "ja": "ホームカミングデイ（大岡山）のため授業休み"
      }
    },
    {
      "date": "2026-07-23",
      "type": "replacement",
      "replacementDay": 1,
      "label": {
        "ja": "月曜日の授業"
      }
    },
    {
      "date": "2026-10-09",
      "type": "no-class",
      "label": {
        "ja": "工大祭（準備・片付け含む）のため授業休み"
      }
    },
    {
      "date": "2026-10-10",
      "type": "no-class",
      "label": {
        "ja": "工大祭（準備・片付け含む）のため授業休み"
      }
    },
    {
      "date": "2026-10-11",
      "type": "no-class",
      "label": {
        "ja": "工大祭（準備・片付け含む）のため授業休み"
      }
    },
    {
      "date": "2026-10-12",
      "type": "no-class",
      "label": {
        "ja": "工大祭（準備・片付け含む）のため授業休み"
      }
    },
    {
      "date": "2026-10-15",
      "type": "replacement",
      "replacementDay": 1,
      "label": {
        "ja": "月曜日の授業"
      }
    },
    {
      "date": "2027-01-14",
      "type": "replacement",
      "replacementDay": 1,
      "label": {
        "ja": "月曜日の授業"
      }
    },
    {
      "date": "2027-01-22",
      "type": "no-class",
      "label": {
        "ja": "入試関係業務のため授業休み"
      }
    },
    {
      "date": "2027-01-23",
      "type": "no-class",
      "label": {
        "ja": "入試関係業務のため授業休み"
      }
    }
  ]
}
